{
  "schema_version": 1,
  "catalog_kind": "node_compat_rust_watchpoint_expectations",
  "generated_from": "rust_ignore_attributes",
  "source_path": "crates/nimbus-runtime/src/runtime/tests/node",
  "contract": "Each entry mirrors a Rust #[ignore] watchpoint in the Node compatibility harness. A passing observed result for any cataloged entry is treated as an unexpected pass and should remove the ignore or reclassify the entry.",
  "entries": [
    {
      "id": "node22_process_env_delete_application_preset_watchpoint",
      "test_name": "node22_process_env_delete_application_preset_watchpoint",
      "lane": "node22",
      "expectation": "expected_failure",
      "classification": "watchpoint",
      "reason": "Pinned application-preset restriction: process.env string-key mutation and deletion are intentionally denied outside tooling-owned host surfaces",
      "source_path": "crates/nimbus-runtime/src/runtime/tests/node/cases/watchpoints_core.rs",
      "source_line": 2,
      "unexpected_pass_action": "remove_ignore_and_promote_or_reclassify_expectation"
    },
    {
      "id": "node20_assert_deep_watchpoint",
      "test_name": "node20_assert_deep_watchpoint",
      "lane": "node20",
      "expectation": "expected_failure",
      "classification": "watchpoint",
      "reason": "Shared assert gap: test-assert-deep.js fails with `AssertionError [ERR_ASSERTION]: Expected values to be strictly deep-equal`. The deep-equal comparison disagrees with Node in every lane, so this is not a version divergence",
      "source_path": "crates/nimbus-runtime/src/runtime/tests/node/cases/watchpoints_core.rs",
      "source_line": 22,
      "unexpected_pass_action": "remove_ignore_and_promote_or_reclassify_expectation"
    },
    {
      "id": "node22_assert_partial_deep_equal_watchpoint",
      "test_name": "node22_assert_partial_deep_equal_watchpoint",
      "lane": "node22",
      "expectation": "expected_failure",
      "classification": "watchpoint",
      "reason": "Pinned Node22 runtime gap: official test-assert-partial-deep-equal.js currently aborts through a rusty_v8 weak-handle panic in the embedded runtime path",
      "source_path": "crates/nimbus-runtime/src/runtime/tests/node/cases/watchpoints_core.rs",
      "source_line": 33,
      "unexpected_pass_action": "remove_ignore_and_promote_or_reclassify_expectation"
    },
    {
      "id": "node22_console_issue_43095_watchpoint",
      "test_name": "node22_console_issue_43095_watchpoint",
      "lane": "node22",
      "expectation": "expected_failure",
      "classification": "watchpoint",
      "reason": "Pinned shared Deno-family inspect gap: revoked proxy formatting still throws inside ext/web and blocks test-console-issue-43095.js",
      "source_path": "crates/nimbus-runtime/src/runtime/tests/node/cases/watchpoints_core.rs",
      "source_line": 43,
      "unexpected_pass_action": "remove_ignore_and_promote_or_reclassify_expectation"
    },
    {
      "id": "node20_console_issue_43095_watchpoint",
      "test_name": "node20_console_issue_43095_watchpoint",
      "lane": "node20",
      "expectation": "expected_failure",
      "classification": "watchpoint",
      "reason": "Shared Deno-family inspect gap: test-console-issue-43095.js fails with `TypeError: Cannot inspect a proxy that has been revoked`. Revoked-proxy formatting throws in every lane, so this is not a version divergence",
      "source_path": "crates/nimbus-runtime/src/runtime/tests/node/cases/watchpoints_core.rs",
      "source_line": 53,
      "unexpected_pass_action": "remove_ignore_and_promote_or_reclassify_expectation"
    },
    {
      "id": "node20_events_once_watchpoint",
      "test_name": "node20_events_once_watchpoint",
      "lane": "node20",
      "expectation": "expected_failure",
      "classification": "watchpoint",
      "reason": "Node20 divergence: official v20.20.2 accepts once(emitter, event, null), while the runtime rejects it with `TypeError: The \\\"options\\\" argument must be of type object. Received null`. The events polyfill needs a version-conditional options check",
      "source_path": "crates/nimbus-runtime/src/runtime/tests/node/cases/watchpoints_core.rs",
      "source_line": 64,
      "unexpected_pass_action": "remove_ignore_and_promote_or_reclassify_expectation"
    },
    {
      "id": "node22_supported_lane_whatwg_web_platform_watchpoint",
      "test_name": "node22_supported_lane_whatwg_web_platform_watchpoint",
      "lane": "node22",
      "expectation": "expected_failure",
      "classification": "watchpoint",
      "reason": "NDS3 broad pre-run: ROI-ranked WHATWG/web-platform common required-gap inventory; excludes stress/hang paths and the lane-specific encoding fixture side batch",
      "source_path": "crates/nimbus-runtime/src/runtime/tests/node/cases/watchpoints_core.rs",
      "source_line": 278,
      "unexpected_pass_action": "remove_ignore_and_promote_or_reclassify_expectation"
    },
    {
      "id": "node24_default_lane_whatwg_web_platform_watchpoint",
      "test_name": "node24_default_lane_whatwg_web_platform_watchpoint",
      "lane": "node24",
      "expectation": "expected_failure",
      "classification": "watchpoint",
      "reason": "NDS3 broad pre-run: ROI-ranked WHATWG/web-platform common required-gap inventory; excludes stress/hang paths and the lane-specific encoding fixture side batch",
      "source_path": "crates/nimbus-runtime/src/runtime/tests/node/cases/watchpoints_core.rs",
      "source_line": 291,
      "unexpected_pass_action": "remove_ignore_and_promote_or_reclassify_expectation"
    },
    {
      "id": "node26_current_lane_whatwg_web_platform_watchpoint",
      "test_name": "node26_current_lane_whatwg_web_platform_watchpoint",
      "lane": "node26",
      "expectation": "expected_failure",
      "classification": "watchpoint",
      "reason": "NDS3 node26 broad pre-run: WHATWG/web-platform common required-gap inventory; promote only dynamically green fixtures",
      "source_path": "crates/nimbus-runtime/src/runtime/tests/node/cases/watchpoints_core.rs",
      "source_line": 304,
      "unexpected_pass_action": "remove_ignore_and_promote_or_reclassify_expectation"
    },
    {
      "id": "node24_default_lane_whatwg_encoding_watchpoint",
      "test_name": "node24_default_lane_whatwg_encoding_watchpoint",
      "lane": "node24",
      "expectation": "expected_failure",
      "classification": "watchpoint",
      "reason": "NDS3 side batch: Node24 WHATWG single-byte encoding fixture uses the Node24-only test/fixtures/encoding tree",
      "source_path": "crates/nimbus-runtime/src/runtime/tests/node/cases/watchpoints_core.rs",
      "source_line": 317,
      "unexpected_pass_action": "remove_ignore_and_promote_or_reclassify_expectation"
    },
    {
      "id": "node22_process_finalization_watchpoint",
      "test_name": "node22_process_finalization_watchpoint",
      "lane": "node22",
      "expectation": "expected_failure",
      "classification": "watchpoint",
      "reason": "Pinned later-family dependency: official test-process-finalization.mjs now runs through the Nimbus sync subprocess harness, and the only remaining failure is different-registry-per-thread.mjs because worker_threads are still owned by a later compatibility family",
      "source_path": "crates/nimbus-runtime/src/runtime/tests/node/cases/watchpoints_core.rs",
      "source_line": 369,
      "unexpected_pass_action": "remove_ignore_and_promote_or_reclassify_expectation"
    },
    {
      "id": "node20_perf_hooks_resourcetiming_watchpoint",
      "test_name": "node20_perf_hooks_resourcetiming_watchpoint",
      "lane": "node20",
      "expectation": "expected_failure",
      "classification": "watchpoint",
      "reason": "Node20 divergence: official v20.20.2 PerformanceResourceTiming#toJSON() omits the Node22-era deliveryType and responseStatus fields, so the fixture fails with `AssertionError [ERR_ASSERTION]: Expected values to be strictly deep-equal`. The polyfill needs a version-conditional toJSON() shape",
      "source_path": "crates/nimbus-runtime/src/runtime/tests/node/cases/watchpoints_core.rs",
      "source_line": 379,
      "unexpected_pass_action": "remove_ignore_and_promote_or_reclassify_expectation"
    },
    {
      "id": "node20_stream_readable_infinite_read_watchpoint",
      "test_name": "node20_stream_readable_infinite_read_watchpoint",
      "lane": "node20",
      "expectation": "expected_failure",
      "classification": "watchpoint",
      "reason": "Node20 read-loop gap: with the Node20 default highWaterMark applied, test-stream-readable-infinite-read.js reads 8192 bytes where Node20 reads 16384. The emitReadable_ path in internal/streams/readable.js releases the buffer after one push instead of filling to the highWaterMark, so the default value alone does not close this gap",
      "source_path": "crates/nimbus-runtime/src/runtime/tests/node/cases/watchpoints_core.rs",
      "source_line": 420,
      "unexpected_pass_action": "remove_ignore_and_promote_or_reclassify_expectation"
    },
    {
      "id": "node22_fs_open_watchpoint",
      "test_name": "node22_fs_open_watchpoint",
      "lane": "node22",
      "expectation": "expected_failure",
      "classification": "watchpoint",
      "reason": "Pinned application-preset path-policy divergence: test-fs-open.js expects ENOENT for an absolute missing host path outside the generated bundle root, while Nimbus intentionally denies that path before raw host open",
      "source_path": "crates/nimbus-runtime/src/runtime/tests/node/cases/watchpoints_core.rs",
      "source_line": 431,
      "unexpected_pass_action": "remove_ignore_and_promote_or_reclassify_expectation"
    },
    {
      "id": "node22_fs_readdir_buffer_watchpoint",
      "test_name": "node22_fs_readdir_buffer_watchpoint",
      "lane": "node22",
      "expectation": "expected_failure",
      "classification": "watchpoint",